Lemma	POS	MeaningNumber	LemmaID	MeaningID	DefinitionFull	DefinitionShort	Deletion_Reason
a pari	adjectief	2.0	897087	897108	naar analogie	volgens overeenkomstigheid	Full definition shorter than short
à quatre	bijwoord	1.0	632525	632573	(Frans) met z'n vieren	met vier personen of zaken	Full definition shorter than short
à quatre mains	adjectief	1.0	632577	632579	vierhandig	met of voor vier handen	Full definition shorter than short
à raison de	voorzetsel	2.0	632661	632711	ter waarde van	ten bedrage van	Full definition shorter than short
Aalsmeerder	adjectief	2.0	568	570	van Aalsmeer	van, uit, in Aalsmeer	Full definition shorter than short
aan boord	verbinding	1.0	905259	905260	in de boot	op het schip	Full definition shorter than short
aan boord	verbinding	2.0	905259	905261	in het ruimtevaartuig of ruimtestation	in een vliegtuig, ruimtevaartuig of trein	Full definition shorter than short
aan de alarmbel hangen	verbinding	1.0	907833	907840	alarm slaan	waarschuwen dat iets misgaat	Full definition shorter than short
aan de alarmbel trekken	verbinding	1.0	907834	907841	alarm slaan	waarschuwen dat iets misgaat	Full definition shorter than short
aan de alcohol zijn	verbinding	1.0	907870	907880	veel alcohol drinken	verslaafd zijn aan drank	Full definition shorter than short
aan de alcohol zitten	verbinding	1.0	907871	907879	veel alcohol drinken	verslaafd zijn aan drank	Full definition shorter than short
aan de bel trekken	verbinding	1.0	907855	910689	alarm slaan	waarschuwen dat iets misgaat	Full definition shorter than short
aan de gang gaan	verbinding	1.0	927485	927486	starten	beginnen	Full definition shorter than short
aan de gang krijgen	verbinding	1.0	927495	927497	in werking stellen	in beweging krijgen	Full definition shorter than short
aan den lijve	bijwoord	1.0	915171	915174	in persoon	persoonlijk	Full definition shorter than short
aan één zeel trekken	verbinding	1.0	900043	900047	één lijn trekken	dezelfde belangen nastreven	Full definition shorter than short
aan hetzelfde zeel trekken	verbinding	1.0	900042	900044	één lijn trekken	dezelfde belangen nastreven	Full definition shorter than short
aanbevelenswaardig	adjectief	1.0	627	628	aanbeveling verdienend	waard om aanbevolen te worden	Full definition shorter than short
aanbijten	werkwoord	2.0	695	946915	een eerste beet doen	(van honden) beginnen te bijten	Full definition shorter than short
aanblikken	werkwoord	1.0	432754	947112	de blik vestigen op	min of meer indringend aankijken	Full definition shorter than short
aangaande	voorzetsel	1.0	884	885	ten opzichte van	met betrekking tot	Full definition shorter than short
aanstaand	adjectief	2.0	1510	562126	in de komende tijd gebeurend	toekomstig (van gebeurtenissen)	Full definition shorter than short
aanstonds	bijwoord	1.0	1547	1548	binnen de kortste keren	binnen enkele ogenblikken	Full definition shorter than short
aantrekkelijk	adjectief	1.0	1603	889246	verleidelijk in financieel of economisch opzicht waartoe men zich aangetrokken voelt in lichamelijk opzicht	aanlokkelijk verleidelijk in financieel opzicht verleidelijk in lichamelijk opzicht waar men graag naartoe trekt boeiend	Full definition shorter than short
aanvaardbaar	adjectief	1.0	1617	1618	acceptabel	aanvaard kunnende worden	Full definition shorter than short
aanvangsuur	substantief	1.0	1673	1674	uur van aanvang van een activiteit	tijdstip waarop een activiteit begint	Full definition shorter than short
aanvankelijk	adjectief	2.0	1676	563158	in het begin	in eerste instantie	Full definition shorter than short
aanvoeren	werkwoord	4.0	1703	550454	dirigeren of als participerend musicus aansturen	leiden en vertegenwoordigen captain zijn van muzikaal leiden	Full definition shorter than short
aanzienlijk	adjectief	2.0	1816	568320	aanmerkelijk	in grote of hoge mate	Full definition shorter than short
aardappelmeel	substantief	1.0	1869	1870	aardappelzetmeel	zetmeel van aardappelen	Full definition shorter than short
aardedonker	adjectief	1.0	1926	1927	pikdonker	zeer donker	Full definition shorter than short
aardedonker	substantief	2.0	1926	612738	pikdonker	totale duisternis	Full definition shorter than short
aardig	adjectief	1.0	1971	1972	een aangename, vriendelijke aard hebbend	een aangename aard hebbend blijk gevend van een aangename aard	Full definition shorter than short
aas	substantief	A.2.0	2075	2076	lokaas stukje lokspijs soort lokspijs	lokspijs stukje lokspijs soort lokspijs	Full definition shorter than short
abandonneren	werkwoord	2.0	384531	943204	afstand doen van	afstand doen van (iets)	Full definition shorter than short
Abcoudens	adjectief	1.0	563046	563047	van de Abcoudenaren	van, in, uit Abcoude e.d.	Full definition shorter than short
Abcouds	adjectief	1.0	561971	561973	van de Abcoudenaren	van, in, uit Abcoude e.d.	Full definition shorter than short
abdiceren	werkwoord	1.0	450069	943090	troonsafstand doen	afstand doen van de troon	Full definition shorter than short
abdiqueren	werkwoord	1.0	430764	943113	troonsafstand doen	afstand doen van de troon	Full definition shorter than short
abject	adjectief	1.0	2166	2167	verachtelijk	hoogst verwerpelijk	Full definition shorter than short
abrikoos	substantief	A.1.2	2338	485318	oranjegele kleur	kleur van abrikozen	Full definition shorter than short
abrikoos	substantief	A.1.3	2338	485319	abrikozensmaak	smaak van abrikozen	Full definition shorter than short
abrikoos	substantief	A.1.4	2338	485320	abrikozengeur	geur van abrikozen	Full definition shorter than short
absoluut plafond	verbinding	1.0	904216	904217	absoluut maximum	het hoogst haalbare	Full definition shorter than short
academisch	adjectief	1.0	2485	2486	theoretisch-wetenschappelijk	van, aan of met betrekking tot een universiteit	Full definition shorter than short
acceptabel	adjectief	1.0	2508	2509	aanvaardbaar	geaccepteerd kunnende worden	Full definition shorter than short
acceptatiegraad	substantief	1.0	2520	583168	aanvaardingsgraad	mate waarin men bereid is iets te accepteren	Full definition shorter than short
achillespees	substantief	1.1	2632	875634	achillespeesblessure	blessure aan de achillespees	Full definition shorter than short
achtenswaard	adjectief	1.0	195329	195454	achting verdienend	waard om geacht te worden	Full definition shorter than short
achtenswaardig	adjectief	1.0	2664	2665	achting verdienend	waard om geacht te worden	Full definition shorter than short
achter de vuilkar lopen	verbinding	1.0	929958	929959	vuilnisman zijn	vuilnisophaler zijn	Full definition shorter than short
achterlijk zijn	verbinding	1.0	904448	904449	niet bij het volle verstand zijn	niet bij zijn volle verstand zijn	Full definition shorter than short
achteroplopen	werkwoord	2.0	385624	607239	achterblijven	niet met de tijd meegaan	Full definition shorter than short
achturig	adjectief	1.0	393792	933029	acht uren tellend	uit acht uren bestaand	Full definition shorter than short
achturige werkdag	verbinding	1.0	933034	933036	werkdag die acht uren telt	werkdag die bestaat uit acht uren	Full definition shorter than short
acte de présence	substantief	1.0	639866	639886	tegenwoordigheid	het doen blijken van tegenwoordigheid	Full definition shorter than short
actief	adjectief	A.3.0	3197	571764	in dienst	tewerkgesteld	Full definition shorter than short
actief	adjectief	A.6.0	3197	570986	werkzaam	een bepaalde werking hebbend	Full definition shorter than short
actief	adjectief	A.8.0	3197	571774	in werking	ingeschakeld	Full definition shorter than short
acuut	adjectief	2.0	3320	572722	voor patiënten met een spoedeisende aandoening	onmiddellijk medisch ingrijpen vereisend voor spoedeisende aandoeningen	Full definition shorter than short
ademhalingsstoornis	substantief	1.0	3419	3420	ademhalingsmoeilijkheden	stoornis van de ademhaling	Full definition shorter than short
ademloos	adjectief	3.0	3423	573674	waarbij men de adem inhoudt	waarbij men vergeet adem te halen	Full definition shorter than short
adieu	substantief	B.1.0	3467	650733	laatste groet	afscheidsgroet	Full definition shorter than short
administratief	adjectief	1.0	3484	3485	kantoorwerk betreffend	van, bij of met betrekking tot de administratie	Full definition shorter than short
adviesbevoegdheid	substantief	1.0	3632	233673	bevoegdheid om adviezen te geven	bevoegdheid om advies uit te brengen	Full definition shorter than short
adviesrecht	substantief	1.0	3663	3664	recht om adviezen te geven	recht om advies uit te brengen	Full definition shorter than short
afasiepatiënt	substantief	1.0	3725	3726	patiënt met afasie	iemand die aan afasie lijdt	Full definition shorter than short
affreus	adjectief	1.0	3963	3964	foeilelijk	zeer lelijk	Full definition shorter than short
affreus	adjectief	2.0	3963	3965	afschuwelijk	verschrikkelijk	Full definition shorter than short
afg.	adjectief	1.0	586084	586085	afg.	afgelast	Full definition shorter than short
afgeborsteld	adjectief	2.0	329452	329478	goedverzorgd	onberispelijk	Full definition shorter than short
afhaler	substantief	5.0	4112	551649	vaartuig dat iemand afhaalt, ophaalt	vaartuig dat iemand van een schip afhaalt	Full definition shorter than short
afkeurenswaardig	adjectief	1.0	4172	4173	afkeuring verdienend	waard om afgekeurd te worden	Full definition shorter than short
afkomstig	adjectief	2.0	4217	575370	stammend uit	afgeleid van of ontleend uit	Full definition shorter than short
afkomstig	adjectief	6.0	4217	575174	vervaardigd uit	voortgebracht door	Full definition shorter than short
Afrikaans	adjectief	4.0	4478	575464	in het Afrikaans	behorend tot de Afrikaanse taal	Full definition shorter than short
afstandsgebonden	adjectief	1.0	413213	512522	aan een afstand gerelateerd	gebonden aan een bepaalde afstand	Full definition shorter than short
aftands paard	verbinding	2.0	924397	924399	afgeleefd paard	oud, versleten paard	Full definition shorter than short
afwezig	adjectief	3.0	5185	575612	in gedachten verzonken	er niet bij met zijn gedachten	Full definition shorter than short
afwisselend	adjectief	1.0	5213	5214	afwisseling, verscheidenheid biedend	afwisseling, verscheidenheid vertonend	Full definition shorter than short
afzonderlijk	adjectief	1.0	5313	5314	opzichzelfstaand	op zichzelf beschouwd	Full definition shorter than short
agent in burger	verbinding	1.0	907476	907503	agent in gewone kleding	agent die geen uniform draagt	Full definition shorter than short
agent in uniform	verbinding	1.0	907477	907504	agent in politiekleding	agent die een uniform draagt	Full definition shorter than short
aidslijder	substantief	1.0	402503	501043	aidspatiënt minderwaardig persoon	iemand die aan aids lijdt minderwaardig persoon	Full definition shorter than short
aidspatiënt	substantief	1.0	400234	502100	aidslijder	iemand die aan aids lijdt	Full definition shorter than short
ajuin	substantief	3.0	5537	486220	inwoner van de stad Aalst in Oost-Vlaanderen	inwoner van Aalst speler van een team uit Aalst	Full definition shorter than short
ajuin	substantief	4.0	5537	486253	vagina	vrouwelijk schaamdeel	Full definition shorter than short
aka	bijwoord	A.1.0	356463	882299	bijgenaamd	ook wel bekend als	Full definition shorter than short
akelig	adjectief	1.0	5547	5548	naar	onaangenaam voor de zintuigen	Full definition shorter than short
Albanees	adjectief	1.0	5641	5645	van de Albanezen	van, uit, in Albanië	Full definition shorter than short
alcoholicus	substantief	1.0	5716	5717	alcoholverslaafde	iemand die verslaafd is aan alcohol	Full definition shorter than short
alcoholist	substantief	1.0	5724	5725	alcoholverslaafde	iemand die verslaafd is aan alcohol	Full definition shorter than short
alcoholverslaafde	substantief	1.0	5776	5777	alcoholicus	iemand die verslaafd is aan alcohol	Full definition shorter than short
alcoholvrij	adjectief	1.0	5780	5781	zonder alcohol geen alcohol bevattend	geen alcohol bevattend geen alcohol bevattend	Full definition shorter than short
alcoholvrij	substantief	5.0	5780	578112	alcoholvrije drank	alcoholvrije dranken	Full definition shorter than short
alcoholvrij	adjectief	1.1	5780	578134	zonder alcohol	geen alcohol bevattend	Full definition shorter than short
aldoor	bijwoord	1.0	5800	5801	voortdurend	steeds maar weer	Full definition shorter than short
algemeen	substantief	6.0	5852	580012	de maatschappij	alle mensen samen	Full definition shorter than short
alhamdulillah	tussenwerpsel	1.0	979474	979475	God zij dank	alle lof zij aan Allah	Full definition shorter than short
alla	tussenwerpsel	1.0	5938	631493	toe maar	vooruit dan maar	Full definition shorter than short
alle hoop laten varen	verbinding	1.0	928155	928156	niet meer hopen	alle hoop verliezen	Full definition shorter than short
alleen	bijwoord	6.0	5952	5956	echter	met dit voorbehoud	Full definition shorter than short
alleen	adjectief	1.1	5952	580484	alleenstaand	zonder partner	Full definition shorter than short
allejezus	bijwoord	B.1.0	5992	523943	zeer	buitengewoon	Full definition shorter than short
allejezus	bijwoord	B.2.0	5992	523944	verschrikkelijk	op verschrikkelijke wijze	Full definition shorter than short
allerduurst	adjectief	1.0	412595	934383	buitengewoon duur	het duurst van allemaal	Full definition shorter than short
allerhartelijkst	adjectief	1.0	398546	934188	buitengewoon hartelijk	op de meest hartelijke wijze	Full definition shorter than short
allerkleinst	adjectief	1.0	6046	939485	het kleinst van alle genoemde (abstracte of concrete) zaken, personen of dieren	het kleinst van alle of allen het meest geringe formaat hebbend de jongste leeftijd hebbend	Full definition shorter than short
allerkleinste	substantief	1.0	6048	939492	iemand die het kleinst is van allemaal	iemand die zeer klein is iemand die zeer klein is van formaat iemand die zeer klein is qua leeftijd	Full definition shorter than short
allerleukst	adjectief	1.0	6054	934166	buitengewoon leuk	het leukst van alles	Full definition shorter than short
allesverlammend	adjectief	1.0	433192	516824	alle zaken verlammend	een totaal verlammende uitwerking hebbend	Full definition shorter than short
allochtoon	adjectief	A.1.1	6120	636767	gevormd door allochtonen	bestaande uit allochtonen	Full definition shorter than short
Almeerder	adjectief	2.0	6154	6156	van Almere	van, uit, in Almere	Full definition shorter than short
als dank	verbinding	1.0	902368	902369	als bedanking	om te bedanken	Full definition shorter than short
als een natte krant	verbinding	1.0	906127	906128	futloos	erg slecht	Full definition shorter than short
als een tang op een varken slaan	verbinding	1.0	916815	916817	volstrekt niets te maken hebben met iets	geen enkel zinnig verband hebben met iets	Full definition shorter than short
als een weeskind behandelen	verbinding	1.0	900759	900762	verwaarlozen	slecht behandelen	Full definition shorter than short
als haringen in een ton	verbinding	1.0	896771	896772	dicht tegen elkaar staand	met te veel personen in een kleine ruimte	Full definition shorter than short
als het ei breekt, zal het stinken	verbinding	1.0	911987	911988	als de vriendschap wordt verbroken, zullen er veel verwijten zijn	als de relatie verbroken wordt, komt er veel onaangenaams aan het licht	Full definition shorter than short
als het ware	bijwoord	1.0	365116	962926	in figuurlijke zin	bij wijze van spreken	Full definition shorter than short
als kut op Dirk rijmen	verbinding	1.0	906520	906523	volstrekt niets te maken hebben met iets	geen enkel zinnig verband hebben met iets	Full definition shorter than short
als kut op Dirk slaan	verbinding	1.0	906521	906524	volstrekt niets te maken hebben met iets	geen enkel zinnig verband hebben met iets	Full definition shorter than short
als sardines in een blik	verbinding	1.0	921459	921460	dicht tegen elkaar staand	met te veel personen in een kleine ruimte	Full definition shorter than short
als sprinkhanen uitzwermen	verbinding	1.0	924124	924130	zich massaal verspreiden	ergens in zeer groten getale heentrekken	Full definition shorter than short
als water van een eend afglijden	verbinding	1.0	896591	896592	iemand of iets geheel onberoerd laten	volstrekt geen invloed op iemand of iets hebben	Full definition shorter than short
als zilvervisjes	verbinding	1.0	918018	918019	alle kanten opgaand	snel heen en weer schietend	Full definition shorter than short
alsmede	voegwoord	1.0	6223	6224	alsook	zoals ook	Full definition shorter than short
alsof er een bom was ingeslagen	verbinding	1.0	905404	905405	een enorme rommel	een grote puinhoop	Full definition shorter than short
alsook	voegwoord	1.0	6229	6230	alsmede	zoals ook	Full definition shorter than short
aluhoedje	substantief	1.0	620654	626253	aluminium hoedje	hoedje van aluminiumfolie	Full definition shorter than short
alwaar	bijwoord	1.0	6334	6335	op welke plaats	op de plaats die eerder genoemd is	Full definition shorter than short
Ambonees	adjectief	1.0	6568	6570	van de Ambonezen	van, uit, in Ambon	Full definition shorter than short
Amelander	adjectief	2.0	6748	6750	van Ameland	van, uit, in Ameland	Full definition shorter than short
Amerikaanse notelaar	verbinding	1.0	901975	901976	hickory (Carya)	Amerikaanse notenboom	Full definition shorter than short
Amerikaanse notelaar	verbinding	2.0	901975	901977	hickory	hout van de Amerikaanse notenboom	Full definition shorter than short
amethist	substantief	3.0	6794	6797	violet	de kleur van amethist	Full definition shorter than short
amice	substantief	1.0	6824	6825	vriend	bevriende collega	Full definition shorter than short
ammenooitniet	tussenwerpsel	1.0	979487	979488	bekijk het maar	nooit van mijn leven	Full definition shorter than short
ananas	substantief	1.3	7095	487310	ananassmaak	smaak van ananassen	Full definition shorter than short
ananas	substantief	1.4	7095	487303	ananasgeur	geur van ananassen	Full definition shorter than short
anatoom	substantief	1.0	7111	7112	anatomiespecialist	specialist in de anatomie	Full definition shorter than short
andere koek	verbinding	1.0	900422	900423	heel wat anders	iets heel anders	Full definition shorter than short
Andorrees	adjectief	1.0	7185	7187	van Andorra	van, uit, in Andorra	Full definition shorter than short
Angolees	adjectief	1.0	7258	7260	van Angola	van, uit, in Angola	Full definition shorter than short
angstig	adjectief	1.0	7282	7283	angst voelend	in angst verkerend	Full definition shorter than short
anker	substantief	1.1	7408	313736	afbeelding van een anker	voorstelling van een anker	Full definition shorter than short
ankeren	werkwoord	4.0	7411	568348	(figuurlijk) wortelen in	(figuurlijk) teruggaan op	Full definition shorter than short
ankeren	werkwoord	5.0	7411	568349	combineren met	(figuurlijk) koppelen aan	Full definition shorter than short
Anschluss	substantief	2.0	7512	934595	contact	aansluiting	Full definition shorter than short
appelsienschil	substantief	1.0	203529	203540	sinaasappelschil	schil van een sinaasappel	Full definition shorter than short
Appingedammer	adjectief	2.0	8340	8342	van Appingedam	van, uit, in Appingedam	Full definition shorter than short
apport	tussenwerpsel	1.0	8370	979493	haal	breng hier	Full definition shorter than short
apporte	tussenwerpsel	1.0	980627	980628	haal	breng hier	Full definition shorter than short
arbeidsplicht	substantief	2.0	8731	209931	plicht van een werknemer	plicht van iemand die werkt	Full definition shorter than short
arbeidsuur	substantief	1.0	8776	8777	uur waarin men werkt	uur bestemd voor arbeid	Full definition shorter than short
Ardenner	adjectief	4.0	9026	9030	van de Ardennen	van, uit, in de Ardennen	Full definition shorter than short
Argentijns	adjectief	1.0	9092	9093	kenmerkend voor Argentinië	van, uit, in Argentinië e.d.	Full definition shorter than short
asap	bijwoord	1.0	949045	949046	as soon as possible	as soon as possible (zo spoedig mogelijk)	Full definition shorter than short
asbak	substantief	1.1	9548	309643	zware roker	iemand die veel rookt	Full definition shorter than short
asieltsunami	substantief	1.0	609600	609601	overweldigende stroom aan asielzoekers	overweldigende hoeveelheid asielzoekers	Full definition shorter than short
astmalijder	substantief	1.0	440854	501228	astmapatiënt	iemand die aan astma lijdt	Full definition shorter than short
astmapatiënt	substantief	1.0	9952	9953	patiënt met astma	iemand die aan astma lijdt	Full definition shorter than short
Atjehs	adjectief	1.0	421306	567063	van de Atjehers	van, uit, in Atjeh e.d.	Full definition shorter than short
automobilist	substantief	1.0	10763	10764	bestuurder van een auto	iemand die een auto bestuurt	Full definition shorter than short
baanvast	adjectief	1.0	365147	556584	met een goede wegligging	met een goede wegligging stabiel	Full definition shorter than short
bacovewinkel	substantief	1.0	380728	380730	warwinkel	onoverzichtelijke, chaotische toestand	Full definition shorter than short
bagagedief	substantief	1.0	12008	604000	dief van bagage	iemand die bagage steelt	Full definition shorter than short
Balinees	adjectief	1.0	12283	12287	van de Balinezen	van, uit, in Bali	Full definition shorter than short
bang	adjectief	A.1.0	12662	12663	angst voelend	in angst verkerend	Full definition shorter than short
bankloper	substantief	1.0	12765	12766	geldloper	iemand die voor zijn beroep geld vervoert	Full definition shorter than short
bariumsulfaat	substantief	1.0	190857	190861	bariet	zwavelzuur zout van barium	Full definition shorter than short
barokschilder	substantief	1.1	393313	604042	barokschilderij	schilderij van een barokschilder	Full definition shorter than short
bebrild	adjectief	1.0	13732	13733	brildragend met een tekening voorzien van een bril	voorzien van een bril voorzien van een getekende bril	Full definition shorter than short
bebroeden	werkwoord	1.0	13734	941329	al broedend bedekt houden van vogels van slangen van vissen van bijen	al broedend bedekt houden van vogels m.b.t. eieren of een nest van slangen m.b.t. eieren van vissen m.b.t. eitjes van bijen m.b.t. eitjes	Full definition shorter than short
bebroeden	werkwoord	1.1	13734	941330	van vogels	van vogels m.b.t. eieren of een nest	Full definition shorter than short
bebroeden	werkwoord	1.2	13734	941331	van slangen	van slangen m.b.t. eieren	Full definition shorter than short
bebroeden	werkwoord	1.3	13734	941332	van vissen	van vissen m.b.t. eitjes	Full definition shorter than short
bebroeden	werkwoord	1.4	13734	941333	van bijen	van bijen m.b.t. eitjes	Full definition shorter than short
bedauwen	werkwoord	2.0	475744	940191	bevochtigen	met vocht bedekken	Full definition shorter than short
bedotten	werkwoord	1.0	13926	13927	belazeren	voor de gek houden	Full definition shorter than short
bedraden	werkwoord	1.0	13930	940378	met bedrading uitrusten	van elektrische draden voorzien	Full definition shorter than short
beenhard	adjectief	1.0	365163	582271	zeer hard	heel erg hard	Full definition shorter than short
beenhard	adjectief	2.0	365163	582272	meedogenloos	niets of niemand ontziend	Full definition shorter than short
beenhard	adjectief	4.0	365163	582285	vaststaand	onherroepelijk	Full definition shorter than short
beenhard	adjectief	5.0	365163	582289	glashard	zonder merkbare aarzeling	Full definition shorter than short
beer	substantief	4.0	14517	14521	mestvocht	vloeibare mest	Full definition shorter than short
beer	substantief	1.2	14517	14525	beeldje van een beer	afbeelding van een beer	Full definition shorter than short
beest	substantief	2.0	14560	209010	landbouwdier	gedomesticeerd dier	Full definition shorter than short
beetgrijpen	werkwoord	1.0	394557	940425	vastgrijpen	stevig vastnemen	Full definition shorter than short
begerenswaardig	adjectief	1.0	14742	14743	te begeren	waard om begeerd te worden	Full definition shorter than short
behandelbaar	adjectief	2.0	15009	940559	te gebruiken, te hanteren zijn	(van producten, stoffen) te gebruiken zijn	Full definition shorter than short
behartigenswaardig	adjectief	1.0	198444	198445	waard om te behartigen	waard om ter harte genomen te worden	Full definition shorter than short
beklagenswaardig	adjectief	1.0	15437	15438	deerniswekkend	waard om beklaagd te worden	Full definition shorter than short
bel	substantief	1.1	15547	621049	belgeluid	geluid van een bel	Full definition shorter than short
bel	substantief	1.3	15547	573296	deurbelgeluid	geluid van een deurbel	Full definition shorter than short
belatafelen	werkwoord	1.0	431440	940479	beduvelen	voor de gek houden	Full definition shorter than short
belichter	substantief	2.0	16149	634566	apparaat waarmee iets belicht wordt	apparaat dat zorgt voor de belichting	Full definition shorter than short
beloftevol	adjectief	1.0	16244	16245	vol van belofte of beloften	een belofte of beloften inhoudend	Full definition shorter than short
Bengaals	adjectief	3.0	386779	513902	van de Bengalen	van, uit, in Bangladesh	Full definition shorter than short
Bengalees	adjectief	1.0	16483	16485	van de Bengalezen	van, uit, in Bangladesh	Full definition shorter than short
benijdenswaardig	adjectief	1.0	16510	16511	begerenswaardig	waard om benijd te worden	Full definition shorter than short
benzine	substantief	1.1	16543	619928	benzinesoort	soort benzine	Full definition shorter than short
berg	substantief	3.0	16768	16770	stapel	grote hoeveelheid	Full definition shorter than short
berg van barmhartigheid	verbinding	1.0	895488	895489	pandjeshuis	bank van lening	Full definition shorter than short
berkenpollen	substantief	1.0	205430	205437	pollen van de berk	stuifmeel van de berk	Full definition shorter than short
berkenstuifmeel	substantief	1.0	205486	205499	pollen van de berk	stuifmeel van de berk	Full definition shorter than short
beschermwaardig	adjectief	1.0	17519	17520	bescherming verdienend	waard om beschermd te worden	Full definition shorter than short
besdragend	adjectief	1.0	17595	383507	bessen dragend	bessen voortbrengend	Full definition shorter than short
beslapen	werkwoord	2.0	17607	940153	geslachtsgemeenschap, seks hebben met	geslachtsgemeenschap hebben met iemand	Full definition shorter than short
beslissingsbevoegdheid	substantief	1.0	17625	17626	bevoegdheid om iets te besluiten	bevoegdheid om beslissingen te nemen	Full definition shorter than short
