Lemma	POS	MeaningNumber	LemmaID	MeaningID	DefinitionFull	DefinitionShort	Deletion_Reason
het kwade brein	verbinding	1.0	585961	894707	de aanstichter	de boosaardige bedenker	Full definition shorter than short
het loopt tegen de avond	verbinding	1.0	908653	908654	de avond nadert	de avond breekt bijna aan	Full definition shorter than short
het zout in de pap niet waard zijn	verbinding	1.0	918883	918885	niet veel waard zijn	niet veel voorstellen of presteren	Full definition shorter than short
het zout op zijn patatten niet waard zijn	verbinding	1.0	897726	897727	niet veel waard zijn	niet veel voorstellen of presteren	Full definition shorter than short
het zwarte beest	verbinding	1.0	910650	910651	angstgegner	gevreesde tegenstander	Full definition shorter than short
hobbyen	werkwoord	1.0	270701	270702	een hobby beoefenen	een hobby uitoefenen	Full definition shorter than short
hondsgemeen	adjectief	1.0	953159	953161	ingemeen ervan blijk gevend dat iemand heel erg gemeen is	heel erg gemeen ervan blijk gevend heel erg gemeen te zijn	Full definition shorter than short
Hondurees	adjectief	1.0	67841	67843	van Honduras	van, uit, in Honduras e.d.	Full definition shorter than short
hongerlijdertje	substantief	3.0	501323	501337	iemand met een zeer gering inkomen	iemand die zeer arm is kind dat zeer arm is	Full definition shorter than short
hongerlijdertje	substantief	3.1	501323	501436	armoelijdertje	kind dat zeer arm is	Full definition shorter than short
hoog te paard zitten	werkwoord	1.0	924589	924590	vanuit een ivoren toren opereren	zich verheven boven anderen voelen	Full definition shorter than short
hoop	substantief	B.3.0	68613	634770	menigte	grote groep mensen	Full definition shorter than short
hoop	substantief	A.1.1	68613	634729	toeverlaat	diegene of datgene waarop men hoopt	Full definition shorter than short
hou je waffel	verbinding	1.0	918946	918958	zwijg!	hou je mond!	Full definition shorter than short
huispoes	substantief	1.1	197425	197431	huis-tuin-en-keukenpoes	poes die geen raspoes is	Full definition shorter than short
huis-tuin-en-keuken-	overige	1.0	613248	613252	alledaags	niet bijzonder	Full definition shorter than short
Huizer	adjectief	2.0	69759	69761	van Huizen	van, in, uit Huizen e.d.	Full definition shorter than short
humorvol	adjectief	3.0	70149	229265	zeer humoristisch	veel humor bevattend	Full definition shorter than short
iemand bij de kraag grijpen	verbinding	1.0	906065	906068	iemand aanhouden	iemand arresteren	Full definition shorter than short
iemand bij de kraag vatten	verbinding	1.0	906066	906069	iemand aanhouden	iemand arresteren	Full definition shorter than short
iemand de baas kunnen	verbinding	2.0	910550	910577	beter zijn dan iemand	van iemand kunnen winnen	Full definition shorter than short
iemand door de kop schieten	verbinding	2.0	906334	906336	in iemands hoofd opkomen	iemand te binnen schieten	Full definition shorter than short
iemand een kop kleiner maken	verbinding	1.0	906050	906051	iemand eronder krijgen	iemand onthoofden of uitschakelen	Full definition shorter than short
iemand een loer draaien	verbinding	1.0	894861	894862	iemand voorliegen	iemand voor de gek houden	Full definition shorter than short
iemand het ei uit zijn gat vragen	verbinding	1.0	911945	911946	iemand helemaal uitvragen	alles over iemand willen weten	Full definition shorter than short
iemand iets in de schoenen schuiven	verbinding	1.0	896031	896032	iemand van iets beschuldigen	iemand ergens de schuld van geven	Full definition shorter than short
iemand in de boot nemen	verbinding	1.0	905238	905239	iemand beetnemen	een grap met iemand uithalen	Full definition shorter than short
iemand in de kraag grijpen	verbinding	1.0	906063	906070	iemand aanhouden	iemand arresteren	Full definition shorter than short
iemand in de kraag vatten	verbinding	1.0	906064	906071	iemand aanhouden	iemand arresteren	Full definition shorter than short
iemand in zijn sop laten gaarkoken	verbinding	1.0	913776	913779	iemand aan zijn lot overlaten	zich niet meer met iemand bemoeien	Full definition shorter than short
iemand in zijn zure saus laten gaarkoken	verbinding	1.0	913777	913778	iemand aan zijn lot overlaten	zich niet meer met iemand bemoeien	Full definition shorter than short
iemand klem rijden	verbinding	1.0	895846	895847	iemand hinderen met het uitvoeren van zijn plannen	iemand tegenhouden bij het uitvoeren van zijn plannen	Full definition shorter than short
iemand niet aan zijn kop kunnen hebben	verbinding	1.0	906082	906083	iemand gezeur niet kunnen velen	geen gezeur van iemand kunnen hebben	Full definition shorter than short
iemand wandelen sturen	verbinding	1.0	919456	919459	iemand onverrichter zake terugsturen	iemands plannen of voornemens afwijzen	Full definition shorter than short
iemand wandelen zenden	verbinding	1.0	919457	919458	iemand onverrichter zake terugsturen	iemands plannen of voornemens afwijzen	Full definition shorter than short
iemands gezicht vergeten	verbinding	1.0	915912	915913	iemand niet meer herkennen	vergeten hoe iemand eruitziet	Full definition shorter than short
iets in de aard van	verbinding	1.0	904065	904066	iets zoals	iets wat lijkt op	Full definition shorter than short
iets in het verkeer brengen	verbinding	1.0	921070	921071	iets op de markt brengen	iets in de handel brengen	Full definition shorter than short
iets in zijn kop halen	verbinding	1.0	906351	906356	erover denken	op het idee komen	Full definition shorter than short
iets in zout leggen	verbinding	1.0	918375	918376	ietsi nmaken in zout	iets inzouten om het te conserveren	Full definition shorter than short
iets in zout zetten	verbinding	1.0	918374	918377	iets inmaken in zout	iets inzouten om het te conserveren	Full definition shorter than short
iets is de baas over iemand	verbinding	1.0	910573	910574	iets houdt iemand in de greep	iemand heeft geen controle over iets	Full definition shorter than short
iets of iemand uit een boek	verbinding	1.0	900879	900880	iets wat of iemand die bedacht is	iets wat of iemand die niet echt is	Full definition shorter than short
iets te boek stellen	verbinding	1.0	900874	900875	iets vastleggen in een boek	een boek schrijven over iets	Full definition shorter than short
iets ten top drijven	verbinding	1.0	911614	911615	iets tot in extreme mate opdrijven	iets in een extreme toestand brengen	Full definition shorter than short
iets uit het vergeetboek tevoorschijn toveren	verbinding	1.0	920901	920902	iets aan de vergetelheid ontrukken	iets wat al vergeten was weer onder de aandacht brengen	Full definition shorter than short
i.h.b.	bijwoord	1.0	70732	70733	met name	in het bijzonder	Full definition shorter than short
i.i.g.	bijwoord	1.0	558274	558275	hoe dan ook	in ieder geval	Full definition shorter than short
image	substantief	3.0	71301	308708	plaatje	digitale afbeelding	Full definition shorter than short
impermeabel	substantief	2.0	365586	567727	regenjas	waterdichte jas	Full definition shorter than short
in ademnood komen	verbinding	2.0	904539	904540	in moeilijke omstandigheden komen	in moeilijke omstandigheden verkeren	Full definition shorter than short
in ademnood verkeren	verbinding	2.0	904550	904552	geldgebrek hebben	in moeilijke omstandigheden verkeren	Full definition shorter than short
in bloem staan	verbinding	2.0	904717	904719	versierd zijn met bloemen	vol staan met bloeiende planten	Full definition shorter than short
in de bonen	verbinding	1.0	905349	905350	verward	in de war	Full definition shorter than short
in de dop	verbinding	1.0	904017	904018	in spe	in wording	Full definition shorter than short
in de puree	verbinding	1.0	929940	929941	helemaal stuk	helemaal kapot	Full definition shorter than short
in de puree zitten	verbinding	1.0	519179	929945	in angst verkeren	in de problemen zitten	Full definition shorter than short
in de vaart komen	verbinding	1.0	920478	920479	voor de scheepvaart ingezet worden	als vaartuig in gebruik genomen worden	Full definition shorter than short
in de vis	verbinding	1.0	923529	923530	in de vishandel	in de visverkoop	Full definition shorter than short
in de voetsporen van zijn vader	verbinding	1.0	920510	920511	op dezelfde wijze als zijn vader	naar het voorbeeld van zijn vader	Full definition shorter than short
in de winkel staan	verbinding	2.0	919385	919387	winkelbediende zijn	als verkoper in een winkel werken	Full definition shorter than short
in een dalletje zitten	verbinding	1.0	911906	911907	weinig fut hebben	niet lekker in zijn vel zitten	Full definition shorter than short
in een hutje op de hei	verbinding	1.0	917283	917284	zeer afgelegen	niet in contact met anderen	Full definition shorter than short
in een lekke boot zitten	verbinding	1.0	905245	905246	dreigen ten onder te gaan	in moeilijke omstandigheden verkeren	Full definition shorter than short
in het aas bijten	verbinding	1.0	904126	904127	toehappen	gretig aannemen	Full definition shorter than short
in staatshanden	bijwoord	1.0	435345	938288	in handen van de staat	in het bezit van de staat	Full definition shorter than short
in veilige haven	verbinding	1.0	903665	903666	uit de gevarenzone	op een veilige plaats	Full definition shorter than short
industrieel	adjectief	A.1.1	72156	524252	uit een fabriek	door de industrie geproduceerd	Full definition shorter than short
inslaan als een bom	verbinding	1.0	905389	905390	als een klap aankomen	hevige onrust veroorzaken	Full definition shorter than short
inslaan als een bom	verbinding	2.0	905389	905391	een klapper zijn	meteen een groot succes zijn	Full definition shorter than short
Irakees	adjectief	1.0	74672	74674	van Irak	van, uit, in Irak e.d.	Full definition shorter than short
Iranees	adjectief	1.0	544525	544574	van de Iranezen	van, uit, in Iran e.d.	Full definition shorter than short
jaarling	substantief	1.0	74962	74963	enter	dier van een jaar oud	Full definition shorter than short
Jan Modaal	substantief	1.0	590930	590935	prototype van de gemiddelde werknemer	de gemiddelde werknemer de gemiddelde man	Full definition shorter than short
Jan Modaal	substantief	1.1	590930	590957	de doorsneeman	de gemiddelde man	Full definition shorter than short
je moet een broedende kip niet storen	verbinding	1.0	896184	896185	je moet iemand die ergens mee bezig is niet storen	je moet iemand die iets aan het doen is met rust laten	Full definition shorter than short
jichtlijder	substantief	1.0	402666	501035	jichtpatiënt	iemand die aan jicht lijdt	Full definition shorter than short
jichtpatiënt	substantief	1.0	501042	502796	patiënt met jicht	iemand die aan jicht lijdt	Full definition shorter than short
jobstudent	substantief	1.0	75886	75887	student met een job	student met een baan	Full definition shorter than short
jofel	adjectief	5.0	75932	75937	voorspoedig	op een vlotte en wenselijke, prettige wijze	Full definition shorter than short
jonkie	substantief	5.0	76153	577416	jonge jenever	glas jonge jenever	Full definition shorter than short
journaliste	substantief	1.0	76206	76207	vrouwelijke journalist	vrouw die journalist is	Full definition shorter than short
kabouter	substantief	2.0	76980	220243	dwerg	zeer klein persoon	Full definition shorter than short
kamelenweg	substantief	1.0	207852	220093	kamelenroute	weg die de kamelen nemen	Full definition shorter than short
kanoën	werkwoord	1.0	77661	77662	kanovaren	met een kano varen	Full definition shorter than short
kantje	substantief	3.0	77732	649756	aspect	eigenschap	Full definition shorter than short
kantje boord zijn	verbinding	1.0	601328	905278	bijna mislukken	op het nippertje slagen	Full definition shorter than short
Kantonees	adjectief	1.0	77743	77745	van Kanton	van, uit, in Kanton e.d.	Full definition shorter than short
Kantonees	adjectief	4.0	77743	77747	in de Kantonese taal	van, in het Kantonees	Full definition shorter than short
kasyu	substantief	3.0	601738	602941	acajouboom	boom waaraan de cashewnoten groeien	Full definition shorter than short
kat	substantief	4.0	78332	78336	snauw	bitse opmerking	Full definition shorter than short
kattin	substantief	1.0	196502	196532	vrouwtjeskat	vrouwelijke kat	Full definition shorter than short
kees	substantief	B.3.0	78802	200935	penis	mannelijk lid	Full definition shorter than short
keinijg	adjectief	1.0	451207	549395	steengoed	heel erg goed	Full definition shorter than short
keitof	adjectief	1.0	365641	549404	supertof	heel erg tof	Full definition shorter than short
kers	substantief	2.1	79346	529053	kersenhout	hout van de kersenboom	Full definition shorter than short
kidnapping	substantief	1.3	79763	636480	juridische aanklacht wegens kidnapping	(metonymisch) aanklacht wegens ontvoering	Full definition shorter than short
kiften	werkwoord	1.0	79944	79945	ruziën	ruziemaken	Full definition shorter than short
kijken alsof je je laatste oortje versnoept hebt	verbinding	1.0	921221	921222	beteuterd kijken	teleurgesteld kijken	Full definition shorter than short
kinderarm	adjectief	B.1.2	665948	885362	weinig kinderen tellend	uit weinig kinderen bestaand	Full definition shorter than short
kinderarme	substantief	1.0	666166	666169	iemand die kinderarm is	iemand die weinig kinderen heeft	Full definition shorter than short
kinderhoofdje	substantief	1.0	401232	660020	beeldhouwwerk van het hoofdje van een kind	hoofdje van een kind voorstelling van het hoofdje van een kind	Full definition shorter than short
kinderloze	substantief	1.0	666173	666350	iemand die kinderloos is	iemand die geen kind of kinderen heeft	Full definition shorter than short
kinderrijke	substantief	1.0	666150	666154	iemand die kinderrijk is	iemand die veel kinderen heeft	Full definition shorter than short
Kirgies	adjectief	2.0	80532	80534	van de Kirgiezen	van, uit, in Kirgizië e.d.	Full definition shorter than short
kiwi	substantief	4.0	365658	555760	Nieuw-Zeelander	iemand uit Nieuw-Zeeland	Full definition shorter than short
klap in het gezicht	verbinding	1.0	914215	914217	plotselinge schok	gebeurtenis die of bericht dat hard aankomt	Full definition shorter than short
kledder	adjectief	C.1.0	80972	80982	door en door nat	kleddernat, kletsnat	Full definition shorter than short
kloek	adjectief	B.2.0	81761	382059	moedig	vastberaden	Full definition shorter than short
kluns	substantief	1.0	81993	81994	sukkel	onhandig persoon	Full definition shorter than short
knapkop	substantief	2.0	601762	603547	knappe kop	iemand die intelligent is	Full definition shorter than short
knapperd	substantief	1.0	415213	503334	iemand die knap is	iemand met veel kennis	Full definition shorter than short
knapperd	substantief	2.0	415213	503335	iemand die knap is	iemand met een mooi uiterlijk	Full definition shorter than short
kniezerig	adjectief	2.0	406605	559310	tot kniezen aanzettend	aanleiding gevend tot kniezen	Full definition shorter than short
knoflook	substantief	4.0	82580	529643	knoflooksoort	soort knoflook	Full definition shorter than short
knorrig	adjectief	2.0	82666	587154	humeurig	blijk gevend van een slecht humeur	Full definition shorter than short
knul	substantief	2.0	82757	82758	opgeschoten jongen	opgeschoten jonge man	Full definition shorter than short
kogelvrij vest	verbinding	1.0	496832	922756	vest dat kogels tegenhoudt	vest dat beschermt tegen kogels	Full definition shorter than short
kogelwerend vest	verbinding	1.0	514775	922755	vest dat kogels tegenhoudt	vest dat beschermt tegen kogels	Full definition shorter than short
koken	werkwoord	1.1	83329	886830	te warm worden	oververhit raken	Full definition shorter than short
kokendheet	adjectief	2.0	83336	886479	woedend	zeer boos	Full definition shorter than short
koningsdochter	substantief	1.0	401626	636004	prinses	dochter van een koning	Full definition shorter than short
konkelen	werkwoord	2.0	83637	83638	roddelen	kwaadspreken	Full definition shorter than short
kop	substantief	5.0	83997	638571	iets ronds	iets wat op een kop lijkt	Full definition shorter than short
kop en staart	verbinding	1.0	904833	904835	een begrijpelijk geheel	een duidelijk begin en einde	Full definition shorter than short
kop noch staart	verbinding	1.0	904818	904822	niets begrijpelijks	geen duidelijk begin of einde	Full definition shorter than short
kortgerokt	adjectief	1.0	84475	84476	een korte rok dragend	voorzien van een korte rok	Full definition shorter than short
krakeling	substantief	1.0	85011	85012	bros koekje in de vorm van een 8 krakeling van schuim en chocolade	koekje in de vorm van een 8 schuimkrakeling figuur in de vorm van een krakeling	Full definition shorter than short
kredietkaartnummer	substantief	1.0	85209	211962	nummer van een creditcard	nummer van een kredietkaart	Full definition shorter than short
krijger	substantief	1.0	85403	85404	krijgsman	iemand die krijg voert	Full definition shorter than short
krijger	substantief	3.0	85403	85406	ontvanger	iemand die iets krijgt	Full definition shorter than short
kromanti	substantief	1.0	426450	604404	kromantiwinti	luchtgod in de wintireligie	Full definition shorter than short
kruimel	substantief	3.0	85813	563361	kleinigheid	klein beetje	Full definition shorter than short
kunstlederen	adjectief	2.0	421250	503784	kunstleren	bekleed met kunstleer	Full definition shorter than short
kuttenkop	substantief	1.0	415216	517287	kutwijf	afschuwelijke vrouw	Full definition shorter than short
kwaad	adjectief	A.2.0	86560	86565	met slechte bedoelingen	slecht in moreel opzicht	Full definition shorter than short
kwade	substantief	1.0	585157	600941	iemand die kwaad doet	iemand die boosaardig is	Full definition shorter than short
kwade geest	verbinding	1.0	585975	894711	onheil brengende kracht	kwaadaardig geestelijk wezen	Full definition shorter than short
kwade kracht	verbinding	1.0	894716	894718	onheil brengende kracht	kwaadaardig geestelijk wezen	Full definition shorter than short
kwade macht	verbinding	1.0	894717	894721	onheil brengende kracht	kwaadaardig geestelijk wezen	Full definition shorter than short
kwade tong	verbinding	1.0	894725	894727	kwaadspreker	iemand die kwaadspreekt	Full definition shorter than short
kwade trouw	verbinding	1.0	894753	894754	oneerlijkheid	oneerlijke bedoelingen	Full definition shorter than short
kwade wil	verbinding	1.0	894758	894760	slechte wil	slechte bedoelingen	Full definition shorter than short
kwajongen	substantief	2.0	86610	573330	snotneus	jonge jongen	Full definition shorter than short
kwatta	substantief	1.0	604485	604490	kwatta-aap	zwarte slingeraap	Full definition shorter than short
lachlust	substantief	1.0	87251	87252	zin om te lachen	lust om te lachen	Full definition shorter than short
ladelichter	substantief	1.0	87285	87286	dief	iemand die steelt uit de geldla	Full definition shorter than short
laffelijk	bijwoord	1.0	365699	549458	lafhartig	op laffe wijze	Full definition shorter than short
langsrazend	adjectief	1.0	467491	644228	iets of iemand voorbijrazend	in razende vaart ergens langs gaand	Full definition shorter than short
lapidair	adjectief	1.1	88164	213348	beknopt	ongenuanceerd	Full definition shorter than short
Leeuwardens	adjectief	1.0	541407	541482	van Leeuwarden	van, in, uit Leeuwarden	Full definition shorter than short
Leeuwarder	adjectief	2.0	89099	89101	van Leeuwarden	van, uit, in Leeuwarden e.d.	Full definition shorter than short
Leeuwards	adjectief	1.0	541369	541376	van Leeuwarden	van, uit, in Leeuwarden	Full definition shorter than short
Leeuwards	adjectief	2.1	541369	541393	behorend tot het Stadsfries	van, in, uit het Stadsfries e.d.	Full definition shorter than short
Lelystads	adjectief	1.0	479631	558344	van de Lelystedelingen	van, uit, in Lelystad e.d.	Full definition shorter than short
lenteseizoen	substantief	1.0	509182	509184	deel van het jaar waarin het lente is	seizoen van de lente periode van de lente in een bepaald jaar	Full definition shorter than short
leprapatiënt	substantief	1.0	501486	502030	lepralijder	iemand die aan lepra lijdt	Full definition shorter than short
leproos	substantief	1.0	89552	89553	leprapatiënt	iemand die aan lepra lijdt	Full definition shorter than short
lesbienne	substantief	1.0	89625	89626	lesbische vrouw	vrouw die lesbisch is	Full definition shorter than short
levensavond	substantief	1.0	89848	89849	de oude dag	de levensfase van de ouderdom	Full definition shorter than short
lezenswaardig	adjectief	1.0	90167	90168	het lezen waard	waard om gelezen te worden	Full definition shorter than short
lezeres	substantief	1.0	90202	90203	vrouwelijke lezer	vrouw die iets leest	Full definition shorter than short
lgbt	substantief	1.0	643239	643522	lesbian, gay, bisexual, transgender	lesbienne, gay, biseksueel, transgender	Full definition shorter than short
lichtallergie	substantief	2.0	278593	929936	fotocontactallergie	allergie voor bepaalde stof bij licht	Full definition shorter than short
lijkbewasser	substantief	1.0	601863	604848	aflegger	iemand die lijken aflegt	Full definition shorter than short
lispelen	werkwoord	3.0	91452	526656	fluisteren	zacht of fluisterend spreken	Full definition shorter than short
loonzakje	substantief	2.0	92176	659280	(iemands) inkomen	(figuurlijk) inkomen	Full definition shorter than short
losse flodder	verbinding	1.0	901559	912451	munitie zonder projectiel	huls en kruitlading zonder kogel	Full definition shorter than short
lovenswaardig	adjectief	1.0	92524	92525	het loven waard	waard om geloofd te worden	Full definition shorter than short
luieren	werkwoord	1.0	92873	92874	lui zijn	niets uitvoeren	Full definition shorter than short
lul-de-behanger	substantief	1.0	92987	516960	stommeling	suffige of onhandige man	Full definition shorter than short
maaglijder	substantief	1.0	394287	505603	maagpatiënt	iemand die aan een maagkwaal lijdt	Full definition shorter than short
maatje	substantief	1.5	93756	207721	gozer	jongen	Full definition shorter than short
mager boontje	verbinding	1.0	905308	905309	mager persoon	iemand die mager is	Full definition shorter than short
magneetbaan	substantief	1.1	94166	94168	magneettrein	trein die op een magneetbaan rijdt	Full definition shorter than short
Malinees	adjectief	1.0	94516	94519	van de Malinezen	van Mali of de Malinezen	Full definition shorter than short
Maltees	adjectief	1.0	94574	94577	van de Maltezen	van Malta of de Maltezen	Full definition shorter than short
Maltees	substantief	3.0	94574	94576	de Maltese taal	taal van de Maltezen	Full definition shorter than short
Maltezer	adjectief	3.0	94582	94585	van de Maltezers	van Malta of de Maltezers	Full definition shorter than short
mampier	substantief	1.0	419062	601888	knut	zeer kleine, bloedzuigende mug	Full definition shorter than short
mastodont	substantief	6.0	95653	233557	groot exemplaar	dier dat zeer groot is in zijn soort	Full definition shorter than short
m.a.w.	bijwoord	1.0	386953	512499	anders gezegd	met andere woorden	Full definition shorter than short
medium	adjectief	B.1.2	96717	555290	tussen small en large	middelgroot van portie	Full definition shorter than short
meebeleven	werkwoord	1.0	96739	96740	samen met een ander of anderen getuige zijn van, deelgenoot zijn van, ondervinden	samen met een ander of anderen beleven met anderen op tv of in de bioscoop beleven met anderen bijwonen en beleven	Full definition shorter than short
meebidden	werkwoord	2.0	403657	941138	samen met een ander of anderen opzeggen	met een ander of anderen biddend uitspreken	Full definition shorter than short
meedansen	werkwoord	1.1	96757	941164	dansend bewegen	als het ware meedoen aan een dans	Full definition shorter than short
mee-eten	werkwoord	1.0	96733	96734	gezamenlijk een maaltijd gebruiken	samen met een ander of anderen eten	Full definition shorter than short
mee-eten	werkwoord	2.0	96733	940687	erbij opeten	samen met ander voedsel eten	Full definition shorter than short
meelmaatschappij	substantief	1.0	601914	607589	handelsmaatschappij in meel	maatschappij die meel verhandelt	Full definition shorter than short
meerderjarige	substantief	1.0	96895	96896	iemand die meerderjarig is	iemand van achttien jaar of ouder	Full definition shorter than short
meeroken	werkwoord	2.0	96966	941599	met een ander of anderen een stikkie roken	met een ander of anderen roken met een ander of anderen een joint roken	Full definition shorter than short
meeroudergezin	substantief	2.0	313062	313664	traditioneel gezin	gezin met twee ouders	Full definition shorter than short
meesteres	substantief	5.1	97165	559912	bazin	eigenares van een huisdier	Full definition shorter than short
meewillen	werkwoord	4.0	97285	941972	gunstig zijn (om iets te bereiken)	meezitten onder invloed van de omstandigheden gedijen	Full definition shorter than short
meloen	substantief	1.1	97682	537736	meloen als stof	vruchtvlees van een meloen	Full definition shorter than short
menthol	substantief	2.0	98056	98058	mentholsigaret	mentholsigaret(ten)	Full definition shorter than short
Meppeler	adjectief	2.0	98114	98116	van de Meppelers	van, uit, in Meppel e.d.	Full definition shorter than short
merendeels	bijwoord	1.0	98148	98149	het merendeel omvattend	voor het grootste gedeelte	Full definition shorter than short
mest	substantief	1.1	98257	611480	dierenstront	ontlasting van een dier	Full definition shorter than short
met blijdschap in het hart	verbinding	1.0	926145	926147	vol vreugde	met veel blijdschap	Full definition shorter than short
met bloedend hart	verbinding	1.0	895628	895630	met tegenzin	met veel verdriet	Full definition shorter than short
met de daver op het lijf	verbinding	1.0	903058	903059	bevend van schrik	trillend van angst	Full definition shorter than short
met de hand op het hart	verbinding	1.0	926163	926164	in alle eerlijkheid	oprecht in alle ernst	Full definition shorter than short
met de kippen op stok gaan	verbinding	1.0	896172	896173	vroeg gaan slapen	vroeg naar bed gaan	Full definition shorter than short
met de rug tegen de muur staan	verbinding	2.0	926932	926934	geen uitweg meer zien	geen kant meer op kunnen	Full definition shorter than short
met de tong op de schoenen	verbinding	1.0	895898	895901	uitgeteld	heel erg moe	Full definition shorter than short
met een bang hart	verbinding	1.0	926167	926168	vervuld van angst	met een bang gemoed	Full definition shorter than short
