Lemma	POS	MeaningNumber	LemmaID	MeaningID	DefinitionFull	DefinitionShort	Deletion_Reason
een sik hebben van iets	verbinding	1.0	899303	899307	ergens helemaal klaar mee zijn	helemaal genoeg hebben van iets	Full definition shorter than short
een sik krijgen van iets	verbinding	1.0	899304	899305	ergens helemaal klaar mee zijn	helemaal genoeg hebben van iets	Full definition shorter than short
een slecht geweten	verbinding	1.0	585986	894696	een kwaad geweten	een gevoel van schuld	Full definition shorter than short
een slecht seizoen	verbinding	1.0	899498	899501	een seizoen met een slechte oogst	een seizoen met weinig oogst of succes	Full definition shorter than short
een vol decennium	verbinding	1.0	911225	911226	een volledig decennium	een volledige periode van tien jaar	Full definition shorter than short
een vol halfuur	verbinding	1.0	903460	903464	zeker 30 minuten	een volledig halfuur	Full definition shorter than short
een weg bewandelen	verbinding	1.0	897261	897262	(beginnen te) handelen op de genoemde wijze	een bepaalde handelwijze (beginnen te) volgen	Full definition shorter than short
een zoen in ontvangst nemen	verbinding	1.0	918039	918040	een zoen krijgen	een zoen accepteren	Full definition shorter than short
een zware wissel op iets	verbinding	1.0	919191	919198	iets wat veel vergt van iets	iets wat een hoge belasting vormt voor iets	Full definition shorter than short
eerdaags	bijwoord	1.0	45152	45153	binnenkort	binnen afzienbare tijd	Full definition shorter than short
eergisteravond	bijwoord	1.0	45160	45161	op de avond voor gisteren	op de avond van eergisteren	Full definition shorter than short
eergisternacht	bijwoord	1.0	469990	513527	in de nacht voor gisteren	in de nacht van eergisteren	Full definition shorter than short
eeuweling	substantief	1.0	485728	497732	iemand die meer dan honderd jaar oud is	iemand van 100 jaar of ouder iets van 100 jaar of ouder	Full definition shorter than short
eieren op de straatstenen kunnen bakken	verbinding	1.0	911942	911943	zeer warm zijn	tropische temperaturen bereiken	Full definition shorter than short
eigen baas	verbinding	1.0	910599	910601	zelfstandig ondernemer	iemand met een eigen bedrijf	Full definition shorter than short
eikenpollen	substantief	1.0	205433	205447	pollen van de eik	stuifmeel van de eik	Full definition shorter than short
eikenstuifmeel	substantief	1.0	205487	205512	pollen van de eik	stuifmeel van de eik	Full definition shorter than short
eitje	substantief	4.0	249172	249173	fluitje van een cent	gemakkelijk karweitje	Full definition shorter than short
elektrische fietser	verbinding	1.0	912367	912368	iemand die elektrisch fietst	iemand die op een elektrische fiets rijdt	Full definition shorter than short
Elzasser	substantief	2.0	46454	46456	Elzasser wijn	wijn uit de Elzas	Full definition shorter than short
Elzasser	adjectief	3.0	46454	46457	van de Elzassers	van, uit, in de Elzas	Full definition shorter than short
elzenpollen	substantief	1.0	205431	205445	pollen van de els	stuifmeel van de els	Full definition shorter than short
elzenstuifmeel	substantief	1.0	205492	205517	pollen van de els	stuifmeel van de els	Full definition shorter than short
emotioneel	adjectief	1.0	46612	46613	betrekking hebbend op de emoties	betrekking hebbend op het gevoelsleven	Full definition shorter than short
en bloc	bijwoord	2.0	424279	552570	in groten getale	met alle zaken bij elkaar	Full definition shorter than short
en dies meer	verbinding	1.0	490412	876361	en meer van dat soort zaken	en meer van dergelijke zaken	Full definition shorter than short
en dies meer	verbinding	2.0	490412	876368	en meer van dat soort mensen	en meer van dergelijke personen	Full definition shorter than short
en masse	bijwoord	1.0	409487	669631	in groten getale met een grote hoeveelheid dieren tegelijk	met een grote hoeveelheid personen tegelijk met een grote hoeveelheid dieren tegelijk	Full definition shorter than short
en masse	bijwoord	2.0	409487	870982	in grote hoeveelheden	met een grote hoeveelheid zaken tegelijk	Full definition shorter than short
en masse	bijwoord	1.1	409487	870985	met veel tegelijk	met een grote hoeveelheid dieren tegelijk	Full definition shorter than short
Enkhuizer	adjectief	2.0	47031	47033	van Enkhuizen	van, uit, in Enkhuizen	Full definition shorter than short
enthousiast	substantief	5.0	47128	588547	verwoed liefhebber	enthousiast persoon	Full definition shorter than short
entrecote	substantief	2.0	47152	47154	stuk entrecote	stuk rundvlees uit het tussenribstuk	Full definition shorter than short
er is werk aan de winkel	verbinding	1.0	919394	919395	er is werk te verrichten	er valt het nodige te doen	Full definition shorter than short
er met boter en suiker in gaan	verbinding	2.0	501526	927226	gefopt worden	beetgenomen worden	Full definition shorter than short
er met boter en suiker in glijden	verbinding	1.0	501530	927230	gefopt worden	beetgenomen worden	Full definition shorter than short
er met boter en suiker in lopen	verbinding	1.0	501531	927234	gefopt worden	beetgenomen worden	Full definition shorter than short
er met boter en suiker in stinken	verbinding	1.0	501533	927233	gefopt worden	beetgenomen worden	Full definition shorter than short
er met boter en suiker in trappen	verbinding	1.0	501532	927232	gefopt worden	beetgenomen worden	Full definition shorter than short
er staat veel zee	verbinding	1.0	900311	900312	er is veel golfslag	er zijn veel golven op zee	Full definition shorter than short
er zit geen kwaad bij	verbinding	1.0	907001	907002	iemand is goedaardig	iemand heeft een goed karakter	Full definition shorter than short
ergens bekaaid van afkomen	verbinding	1.0	894886	894887	ergens slecht van afkomen	ergens te weinig voor krijgen	Full definition shorter than short
ergens de leeftijd voor hebben	verbinding	1.0	914632	914633	oud genoeg zijn voor iets	ergens oud genoeg voor zijn	Full definition shorter than short
ergens een draai aan geven	verbinding	1.0	894855	894857	ergens een eigen versie van geven	ergens een eigen verhaal van maken	Full definition shorter than short
ergens een mouw aan passen	verbinding	1.0	895815	895816	iets weten te verhelpen	ergens iets aan weten te doen	Full definition shorter than short
ergens een streep door zetten	verbinding	1.0	904867	904868	iets dwarsbomen	ervoor zorgen dat iets niet doorgaat	Full definition shorter than short
ergens geen doekjes om winden	verbinding	1.0	903920	903921	ergens openlijk over praten	ergens geen geheim van maken	Full definition shorter than short
ergens geen pap van lusten	verbinding	1.0	898009	898010	iets niet leuk vinden	ergens niet van houden	Full definition shorter than short
ergens over de koppen kunnen lopen	verbinding	1.0	906006	906007	er is heel veel volk	het is er erg druk met mensen	Full definition shorter than short
ergens veel van weg hebben	verbinding	1.0	897605	897606	alle schijn hebben	ergens veel op lijken	Full definition shorter than short
ergens wel pap van lusten	verbinding	1.0	898012	898013	iets heel erg leuk vinden	ergens heel erg van houden	Full definition shorter than short
eten	werkwoord	A.1.0	47968	47971	iets nuttigen zich door te eten op de hals halen	iets als voedsel tot zich nemen door te eten krijgen	Full definition shorter than short
eten	substantief	B.1.0	47968	515830	voedsel	dat wat iemand eet	Full definition shorter than short
euro-	overige	1.0	219311	219336	Europees met betrekking tot de Europese Unie	met betrekking tot Europa met betrekking tot de EU	Full definition shorter than short
examentijd	substantief	2.0	49101	612574	begintijd en/of eindtijd van een examen	tijd waarop een examen begint of eindigt	Full definition shorter than short
eyecatcher	substantief	1.0	258367	870735	iets wat de aandacht trekt	iets wat in het oog springt	Full definition shorter than short
farmaceut	substantief	2.0	50173	50175	farmaceutisch bedrijf	geneesmiddelenfabrikant	Full definition shorter than short
fatbike	substantief	1.0	941290	941291	elektrische fatbike	elektrische fiets met dikke banden	Full definition shorter than short
feelgood	substantief	2.1	980183	980268	feelgoodfilm of feelgoodboek	film of boek in het feelgoodgenre	Full definition shorter than short
feil	substantief	1.0	50566	50567	gebrek	tekortkoming	Full definition shorter than short
fietspadennet	substantief	1.0	50936	486201	netwerk van onderling verbonden fietspaden	samenstel van onderling verbonden fietspaden	Full definition shorter than short
fijne peper	verbinding	1.0	918773	918776	fijngemalen peper	tot poeder gemalen peperkorrels	Full definition shorter than short
financieel aderlaten	verbinding	1.0	947237	947238	veel te veel geld laten betalen	in financieel opzicht ernstig benadelen	Full definition shorter than short
fittie	substantief	1.0	598199	598543	strijd	gevecht	Full definition shorter than short
flink	adjectief	1.0	51948	51949	welgebouwd	stevig van lichaamsbouw	Full definition shorter than short
flink	adjectief	2.0	51948	589315	kranig	zijn best doend	Full definition shorter than short
flink	adjectief	4.0	51948	589318	zeer	in sterke mate	Full definition shorter than short
flinkerd	substantief	2.0	476016	503357	iemand die flink is	iemand met een flink karakter	Full definition shorter than short
fluïde	substantief	2.0	52193	52195	fluïdum	vloeibaar cosmeticaproduct	Full definition shorter than short
foef	substantief	1.0	52248	52249	vagina	vrouwelijk geslachtsdeel	Full definition shorter than short
framboos	substantief	1.2	53028	517818	frambozengeur	geur van frambozen	Full definition shorter than short
Franeker	adjectief	2.0	53054	53056	van de Franekers	van, uit, in Franeker	Full definition shorter than short
Franse roos	verbinding	1.0	902050	902051	Rosa gallica	roos met rozerode kroonbladen	Full definition shorter than short
frietje	substantief	1.0	425581	518331	patatje	gefrituurd aardappelstaafje	Full definition shorter than short
frietje	substantief	2.0	425581	518345	patatje	portie friet	Full definition shorter than short
futloos	adjectief	2.0	53903	206302	slap	van geen of weinig fut getuigend	Full definition shorter than short
futloosheid	substantief	2.0	53905	228125	slapheid	het van geen of weinig fut getuigen	Full definition shorter than short
futloosheid	substantief	3.0	53905	228126	het slap zijn	het niet veerkrachtig zijn	Full definition shorter than short
gaarkoken	werkwoord	1.0	455528	885731	garen	door koken gaar maken	Full definition shorter than short
gaarkoken	werkwoord	2.0	455528	885735	garen	door koken gaar worden	Full definition shorter than short
gas	substantief	2.1	54456	622144	gasvoorziening	levering van gas	Full definition shorter than short
-gate	overige	1.0	880330	880331	affaire	in samenstellingen: schandaal	Full definition shorter than short
geb.	adjectief	2.0	54801	54803	gebonden	gebonden (van boeken)	Full definition shorter than short
geb.	adjectief	3.0	54801	54804	gebonden	gebonden (van personen)	Full definition shorter than short
gebocheld	adjectief	1.0	54926	54927	met een bochel alsof iemand of iets een bochel heeft	voorzien van een bochel alsof iemand of iets een bochel heeft	Full definition shorter than short
gebochelde	substantief	1.0	447503	653629	bochelaar	iemand met een bochel	Full definition shorter than short
geboortejaar	substantief	1.0	55018	55019	jaar waarin iemand geboren is	jaar van geboorte jaar waarin iets ontstond	Full definition shorter than short
gebrild	adjectief	1.0	55078	55079	een bril hebbend	voorzien van een bril	Full definition shorter than short
gebroken wit	verbinding	1.0	317257	900736	niet zuiver wit	wit dat neigt naar beige	Full definition shorter than short
gebruiksmogelijkheid	substantief	1.0	55166	55167	mogelijkheid om iets te gebruiken	mogelijkheid voor het gebruik van iets	Full definition shorter than short
gebuikt	adjectief	1.0	55255	55256	voorzien van een dikke buik	(van personen) voorzien van een dikke buik	Full definition shorter than short
gecijferdheid	substantief	1.0	571010	571016	vermogen om te kunnen rekenen	het in staat zijn om te rekenen	Full definition shorter than short
gedouw	substantief	1.0	652420	652489	het voortdurend of telkens weer douwen	het voortdurend of herhaaldelijk douwen	Full definition shorter than short
geduw	substantief	1.0	55570	55571	het voortdurend of telkens weer duwen	het voortdurend of herhaaldelijk duwen	Full definition shorter than short
geeltje	substantief	2.0	55633	55634	vijfentwintigguldenbiljet	briefje van vijfentwintig gulden	Full definition shorter than short
geen blad voor de mond nemen	verbinding	1.0	925365	925368	vrijuit zeggen wat men denkt	openhartig zeggen wat men denkt	Full definition shorter than short
geen boon	verbinding	1.0	905334	905336	totaal niet	helemaal niets	Full definition shorter than short
geen dubbeltje	verbinding	1.0	927430	927432	geen enkele	helemaal niets	Full definition shorter than short
geen fluit	verbinding	1.0	495972	912485	totaal niet	helemaal niets	Full definition shorter than short
geen gezicht zijn	verbinding	1.0	915944	915945	er niet uitzien	niet om aan te zien zijn	Full definition shorter than short
geen knip voor de neus waard zijn	verbinding	1.0	910366	917048	waardeloos zijn	niets waard zijn	Full definition shorter than short
geen kop of staart	verbinding	1.0	904820	904827	niets begrijpelijks	geen duidelijk begin of einde	Full definition shorter than short
geen kruimel	verbinding	2.0	495979	906376	totaal niet	helemaal niets	Full definition shorter than short
geen pap meer kunnen zeggen	verbinding	1.0	898015	898016	heel erg moe uit	heel erg moe zijn	Full definition shorter than short
geen pink	verbinding	1.0	924750	924751	totaal niet	helemaal niets	Full definition shorter than short
geen pink bewegen	verbinding	1.0	924788	924789	doodstil zitten	onbeweeglijk zijn	Full definition shorter than short
geen ros	verbinding	1.0	924181	924182	totaal niet	helemaal niets	Full definition shorter than short
geen sikkepit	voornaamwoord	1.0	495965	899259	totaal niet	helemaal niets	Full definition shorter than short
geen vin verroeren	verbinding	1.0	324999	922802	doodstil zijn	onbeweeglijk zijn	Full definition shorter than short
gegleufd	adjectief	1.0	405016	653371	voorzien van een gleuf of van gleuven	voorzien van een gleuf of gleuven voorzien van een vagina	Full definition shorter than short
gehandschoend	adjectief	1.0	55881	644247	omhuld met een handschoen of handschoenen	voorzien van een handschoen of handschoenen	Full definition shorter than short
geitenharen	adjectief	1.0	455954	503692	geitenwollen	gemaakt van geitenhaar	Full definition shorter than short
geitenwollen	adjectief	1.0	56052	56053	geitenharen	gemaakt van geitenwol	Full definition shorter than short
gekidnapte	substantief	1.0	636527	636528	iemand die ontvoerd is	iemand die gekidnapt is	Full definition shorter than short
gekuifd	adjectief	1.0	428791	653233	een kuif hebbend	voorzien van een kuif	Full definition shorter than short
gelaarsd	adjectief	1.0	56335	56336	met laarzen af te leggen door laarzen (van militairen) veroorzaakt	voorzien van laarzen waarvoor laarzen gedragen moeten worden door laarzen veroorzaakt	Full definition shorter than short
gelaarsd	adjectief	1.1	56335	653287	met laarzen af te leggen	waarvoor laarzen gedragen moeten worden	Full definition shorter than short
geldverslindend	adjectief	1.0	56489	56490	zeer duur	zeer veel of te veel geld kostend	Full definition shorter than short
geloofwaardig	adjectief	1.0	56762	56763	het geloven waard	waard om geloofd te worden	Full definition shorter than short
gelukkig	adjectief	1.0	56889	589963	fortuinlijk	door het lot begunstigd	Full definition shorter than short
gelukkig	adjectief	8.0	56889	590020	bij geluk	gelukkigerwijs	Full definition shorter than short
gelukkige verjaardag	verbinding	1.0	920958	920959	ook als wens	prettige verjaardag	Full definition shorter than short
geluksdag	substantief	2.0	397124	543587	dag waarop iemand geluk ten deel valt	dag waarop iemand iets gelukkigs overkomt	Full definition shorter than short
gemeenrechtelijk	adjectief	1.0	365488	643815	overeenkomstig het gemene recht	volgens het algemeen geldend recht	Full definition shorter than short
gemeubeld	adjectief	1.0	57149	57150	gemeubileerd	voorzien van meubels	Full definition shorter than short
Genuees	adjectief	1.0	57582	57584	van de Genuezen	van, uit, in Genua e.d.	Full definition shorter than short
gerecht	substantief	B.1.0	57801	522917	rechtsprekende instantie	rechtbank personen die bij de rechtbank werkzaam zijn	Full definition shorter than short
gerecht	adjectief	C.1.0	57801	523251	terecht	gerechtvaardigd	Full definition shorter than short
gerecht	adjectief	D.1.0	57801	523234	niet krom	recht gemaakt	Full definition shorter than short
gerokt	adjectief	1.0	470285	653440	een rok dragend	voorzien van een rok	Full definition shorter than short
gerokt	adjectief	3.0	470285	653454	een rokkostuum dragend	voorzien van een rokkostuum	Full definition shorter than short
gerust	adjectief	3.0	58015	590552	zonder meer	zonder bezwaar	Full definition shorter than short
gesoigneerd	adjectief	1.0	58257	58258	netjes	verzorgd	Full definition shorter than short
gestolen	adjectief	3.0	58373	58376	heimelijk	vlug en zonder toestemming genomen	Full definition shorter than short
geteisem	substantief	1.1	58463	58465	hinderlijk, abject volk	volk waar men een hekel aan heeft	Full definition shorter than short
getrek	substantief	1.0	58515	58516	het voortdurend of telkens weer trekken	het voortdurend of herhaaldelijk trekken	Full definition shorter than short
geüniformeerd agent	verbinding	1.0	907478	907502	agent in politiekleding	agent die een uniform draagt	Full definition shorter than short
gevondene	substantief	2.0	432628	883363	gevonden persoon iemand die in religieuze zin gered is	iemand die gevonden is iemand die in religieuze zin gered is	Full definition shorter than short
gewapenderhand	bijwoord	1.0	58909	58910	door militair ingrijpen	door wapens te gebruiken	Full definition shorter than short
geweld	substantief	2.0	58937	631065	krachtige inwerking	enorme, niet in te tomen kracht	Full definition shorter than short
geweldig	adjectief	2.0	58950	590766	hard	zeer luid	Full definition shorter than short
geweldig	adjectief	3.0	58950	590763	enorm	buitengewoon groot of sterk	Full definition shorter than short
geweldig	adjectief	4.0	58950	590764	fantastisch	buitengewoon goed of leuk	Full definition shorter than short
geweldig	adjectief	5.0	58950	590765	zeer	in hoge mate	Full definition shorter than short
gewonde	substantief	1.0	59082	59083	gewond persoon	iemand die gewond is	Full definition shorter than short
gezant	substantief	2.0	59172	59174	profeet	religieuze boodschapper	Full definition shorter than short
Ghanees	adjectief	1.0	59561	59563	van de Ghanezen	van, uit, in Ghana e.d.	Full definition shorter than short
gier	substantief	B.1.0	59624	236498	mestvocht	vloeibare mest	Full definition shorter than short
gisteravond	bijwoord	1.0	59856	59857	op de avond van gisteren	op de avond van de vorige dag	Full definition shorter than short
gisterenavond	bijwoord	1.0	479973	513599	op de avond van gisteren	op de avond van de vorige dag	Full definition shorter than short
gisterenmiddag	bijwoord	1.0	433196	513581	in de middag van gisteren	in de middag van de vorige dag	Full definition shorter than short
gisterenmorgen	bijwoord	1.0	395012	513604	in de morgen van gisteren	in de morgen van de vorige dag	Full definition shorter than short
gistermiddag	bijwoord	1.0	59860	59861	in de middag van gisteren	in de middag van de vorige dag	Full definition shorter than short
glansloos	adjectief	2.0	59969	205724	niet levendig	niet sprankelend	Full definition shorter than short
glo	substantief	1.0	422577	597159	basisonderwijs	gewoon lager onderwijs	Full definition shorter than short
God danken op zijn blote knieën	verbinding	1.0	917833	917834	zeer nederig bedanken of danken	zich om iets zeer gelukkig prijzen	Full definition shorter than short
goed van vertrouwen	verbinding	1.0	896148	896149	lichtgelovig	gemakkelijk vertrouwen hebbend	Full definition shorter than short
goedbetaald	adjectief	1.0	60513	60514	veel geld verdienend	een goed salaris hebbend	Full definition shorter than short
goedbetaald	adjectief	2.0	60513	231173	waaraan men veel geld verdient	waarvoor men een goed salaris krijgt	Full definition shorter than short
goedgevormd	adjectief	1.0	60586	60587	welgevormd	een mooie, fraaie vorm hebbend	Full definition shorter than short
goedgevormd	adjectief	2.0	60586	230366	goedopgeleid	een goede opleiding genoten hebbend	Full definition shorter than short
goklust	substantief	1.0	60676	60677	zin om te gokken	lust om te gokken	Full definition shorter than short
graspollen	substantief	1.0	205429	205456	pollen van gras	stuifmeel van gras	Full definition shorter than short
grasstuifmeel	substantief	1.0	205485	205523	pollen van gras	stuifmeel van gras	Full definition shorter than short
grijsaard	substantief	1.0	61815	61816	iemand die bejaard is	oudere man met grijs haar	Full definition shorter than short
groentewinkel	substantief	1.0	62147	62148	winkel waar aardappelen, groente en fruit verkocht wordt	winkel voor aardappelen, groente en fruit gebouw van een groentewinkel	Full definition shorter than short
groentezaak	substantief	1.0	62158	62159	zaak, winkel waar aardappelen, groente en fruit verkocht wordt	winkel waar aardappelen, groente en fruit verkocht wordt gebouw van een groentezaak	Full definition shorter than short
Groninger	adjectief	3.0	62565	62568	van de provincie Groningen	van, uit, in de provincie Groningen e.d.	Full definition shorter than short
Groninger	adjectief	4.0	62565	62569	van de stad Groningen	van, uit, in de stad Groningen e.d.	Full definition shorter than short
guerrillaschommelen	werkwoord	1.0	327979	327985	een guerrillaschommel gebruiken	op een guerrillaschommel schommelen	Full definition shorter than short
Haaksberger	adjectief	2.0	63145	63147	van Haaksbergen	van, uit, in Haaksbergen e.d.	Full definition shorter than short
haarloos	adjectief	1.0	63221	228279	zonder haar	niet of niet meer bedekt met haar	Full definition shorter than short
haarloos	adjectief	2.0	63221	228280	niet behaard	van nature niet bedekt met haar	Full definition shorter than short
haarloos	adjectief	3.0	63221	228281	zonder haar	nog niet bedekt met haar	Full definition shorter than short
Hagenees	adjectief	4.0	415149	539787	van, uit, in de taal van de Hagenaars	van, uit, in de taal van de Hagenaars e.d.	Full definition shorter than short
half weeskind	verbinding	1.0	900764	900766	kind dat een van beide ouders verloren heeft	kind van wie een van beide ouders overleden is	Full definition shorter than short
halfjaar	substantief	3.0	63457	549194	semester	helft van een studiejaar	Full definition shorter than short
hamburger	adjectief	3.0	63642	63645	van Hamburg	van, uit, in Hamburg e.d.	Full definition shorter than short
handtammig	adjectief	1.0	599164	599278	handverlegen	overal met de handen aan zittend	Full definition shorter than short
hapje	substantief	3.0	314934	551085	gerechtje	klein gerecht	Full definition shorter than short
Hardenberger	adjectief	2.0	64300	64302	van Hardenberg	van, uit, in Hardenberg e.d.	Full definition shorter than short
Harlinger	adjectief	2.0	64476	64478	van Harlingen	van, uit, in Harlingen e.d.	Full definition shorter than short
hartlijder	substantief	1.0	64633	64634	hartpatiënt	iemand die aan een hartkwaal lijdt	Full definition shorter than short
Hattemer	adjectief	2.0	64752	64754	van Hattem	van, uit, in Hattem e.d.	Full definition shorter than short
hazelaarpollen	substantief	1.0	205434	205443	pollen van de hazelaar	stuifmeel van de hazelaar	Full definition shorter than short
hazelaarstuifmeel	substantief	1.0	205493	205514	pollen van de hazelaar	stuifmeel van de hazelaar	Full definition shorter than short
heelmeester	substantief	1.2	65026	301801	iets wat geneest	iets wat een genezende werking heeft	Full definition shorter than short
Heerenvener	adjectief	2.0	65115	65117	van Heerenveen	van, uit, in Heerenveen e.d.	Full definition shorter than short
heerlijk	adjectief	3.0	65125	591459	voorbehouden aan de landsheer	van de eigenaar van een heerlijkheid	Full definition shorter than short
Heilooër	adjectief	2.0	547483	547617	van de Heilooërs	van, uit, in Heiloo e.d.	Full definition shorter than short
heraut	substantief	3.0	65768	65771	verkondiger	boodschapper	Full definition shorter than short
herfstseizoen	substantief	1.0	510822	510827	deel van het jaar waarin het herfst is	seizoen van de herfst periode van de herfst in een bepaald jaar	Full definition shorter than short
hesp	substantief	1.1	66523	526906	ham	dij van een mens	Full definition shorter than short
het belletje gaat rinkelen	verbinding	1.0	910716	910717	iets doet ergens aan denken	er komt iets in de herinnering op	Full definition shorter than short
het buskruit niet uitgevonden hebben	verbinding	1.0	901529	901530	nogal dom zijn	niet heel slim zijn	Full definition shorter than short
het doek valt	verbinding	1.0	903914	903915	iets loopt ten einde	iets houdt op te bestaan	Full definition shorter than short
het dubbeltje is gevallen	verbinding	1.0	911661	911662	iets is iemand eindelijk duidelijk geworden	de boodschap is eindelijk tot iemand doorgedrongen	Full definition shorter than short
het gras aan de overkant is altijd groener	spreekwoord	1.0	894511	894512	bij anderen lijkt het altijd beter	ergens anders lijkt het altijd beter	Full definition shorter than short
het groene hart	verbinding	1.0	925866	925867	de groene kern	een groen gebied	Full definition shorter than short
het hazenpad kiezen	verbinding	1.0	907298	928054	aan de haal gaan	uit bangheid op de vlucht gaan	Full definition shorter than short
het is me het avondje wel	verbinding	1.0	908578	908579	dit is bepaald geen avond zoals gewoonlijk	het is een bijzondere of merkwaardige avond	Full definition shorter than short
het krieken van de dag	verbinding	1.0	911085	911092	het aanbreken van de dag	het allereerste begin van de dag	Full definition shorter than short
het Kwaad	verbinding	1.0	907023	907024	Satan	de duivel	Full definition shorter than short
